{
  "$schema": "http://json-schema.org/draft-07/schema#",
  "title": "report.json",
  "description": "Exact contract. Field names, types, ordering and rounding as stated.",
  "type": "object",
  "required": ["generated_at", "source_dates", "schemes_loaded", "schemes_excluded", "exclusions", "by_amc"],
  "additionalProperties": false,
  "properties": {
    "generated_at": {
      "type": "string",
      "description": "ISO 8601 UTC timestamp with a trailing Z, e.g. 2026-08-12T18:30:00Z"
    },
    "source_dates": {
      "type": "array",
      "description": "Every distinct NAV date loaded, as YYYY-MM-DD, ascending.",
      "items": { "type": "string", "pattern": "^\\d{4}-\\d{2}-\\d{2}$" }
    },
    "schemes_loaded": {
      "type": "integer",
      "description": "Distinct schemes that made it into the report."
    },
    "schemes_excluded": {
      "type": "integer",
      "description": "Distinct schemes you deliberately excluded. Must equal the length of exclusions."
    },
    "exclusions": {
      "type": "array",
      "description": "One entry per excluded scheme. Ordered by amfi_code ascending.",
      "items": {
        "type": "object",
        "required": ["amfi_code", "reason"],
        "additionalProperties": false,
        "properties": {
          "amfi_code": { "type": "integer" },
          "reason": { "type": "string", "description": "Short, specific, human-readable." }
        }
      }
    },
    "by_amc": {
      "type": "array",
      "description": "One entry per AMC present in the NAV data. Ordered by amc ascending (plain string sort).",
      "items": {
        "type": "object",
        "required": ["amc", "scheme_count", "median_1d_change_pct"],
        "additionalProperties": false,
        "properties": {
          "amc": {
            "type": "string",
            "description": "AMC name exactly as it appears in the NAV file."
          },
          "scheme_count": {
            "type": "integer",
            "description": "Schemes contributing to the median for this AMC."
          },
          "median_1d_change_pct": {
            "type": ["number", "null"],
            "description": "Median percentage change, rounded to 4 decimal places. Null if not computable."
          }
        }
      }
    }
  }
}
